{"$schema":"../../../schemas/execution-authority-v1.schema.json","schema_version":"execution-authority/v1","grant_id":"ea-mox-201-positive","work_item":"MOX-201","service":"preorder-operations","repository":"thedoughmonster/momi-backend","base_revision":"99c8a6dd0f5306fe9a450e1d1e0ba256bb1931f8","source_digest":"aaaaaaaaaaaaaaaaaaaaaaaaaaaaaaaaaaaaaaaaaaaaaaaaaaaaaaaaaaaaaaaa","filesystem":{"read":[{"path":"docs/contracts/execution-authority-v1.md","kind":"file","recursive":false},{"path":"schemas/execution-authority-v1.schema.json","kind":"file","recursive":false}],"write":[{"path":"tests/fixtures/execution-authority","kind":"directory","recursive":true}]},"database":{"read":[{"owner_service":"preorder-operations","object_kind":"view","qualified_object":"momi_orders.order_headers"}],"write":[{"owner_service":"preorder-operations","object_kind":"table","qualified_object":"momi_orders.order_items"}]},"contracts":{"call":[{"provider_service":"toast-data-acquisition","contract":"momi.toast_order_api.v1"}]},"network":{"connect":[{"protocol":"https","host":"example.com","port":443}]},"secrets":{"reference":["MOMI_TEST_SECRET"]},"packages":{"use":["@momi/test-contract"]},"external":{"invoke":[{"authority_key":"github.contents","operation":"read","resource":"thedoughmonster/momi-backend"}]},"forbidden":{"paths":[".env","supabase/migrations"],"services":["unrelated-service"],"database_objects":["other.private_table"],"contracts":["private.contract.v1"],"hosts":["blocked.example.com"],"secret_names":["PRODUCTION_SECRET"],"external_actions":[],"operation_classes":["deployment","destructive","production","restoration","runtime"]},"escalate_on":["allow_deny_overlap","ambiguous_authority","base_revision_drift","contract_mismatch","cross_owner_target","debt_derived_authority","external_authority_missing","manifest_mismatch","path_escape","protected_operation","provider_leakage","secret_value","unknown_version"],"provenance":{"issue_authorization":{"source":"linear:MOX-201","digest":"bbbbbbbbbbbbbbbbbbbbbbbbbbbbbbbbbbbbbbbbbbbbbbbbbbbbbbbbbbbbbbbb"},"accepted_decisions":[{"source":"linear:comment:4ceb0ac9-4b10-4038-aa81-88eacd6b0d23","digest":"aaaaaaaaaaaaaaaaaaaaaaaaaaaaaaaaaaaaaaaaaaaaaaaaaaaaaaaaaaaaaaaa"}],"repository_rules":[{"source":"AGENTS.md","digest":"cccccccccccccccccccccccccccccccccccccccccccccccccccccccccccccccc"}],"manifests":[{"source":"services/preorder-operations/service.json","digest":"dddddddddddddddddddddddddddddddddddddddddddddddddddddddddddddddd"}],"contracts":[{"source":"docs/contracts/momi-toast-order-api-v1.md","digest":"eeeeeeeeeeeeeeeeeeeeeeeeeeeeeeeeeeeeeeeeeeeeeeeeeeeeeeeeeeeeeeee"}],"external_authorities":[{"source":"external-authority:github.contents","digest":"ffffffffffffffffffffffffffffffffffffffffffffffffffffffffffffffff"}],"runtime_observations":[],"legacy_debt":[]}}
